{
  "draft_summary": "已按总结文种生成初稿。素材包含时间、部门和三项完成工作，缺少具体数据、经验做法和存在问题，正文使用概括性表述并预留占位符。标题和正文中的'部门'需后续确认具体名称，落款缺失。",
  "doc_type": "总结",
  "direction": "内部材料",
  "style_level": 2,
  "risk_level": "low",
  "markdown_draft": "# 部门一季度工作总结\n\n今年一季度，部门围绕年度目标推进各项工作，在制度修订、流程优化和团队培训方面取得初步进展。\n\n## 一、工作开展情况\n\n一季度，部门紧扣年度目标，有序推进各项重点工作。一是完成制度修订，二是推进流程优化，三是组织团队培训。各项工作按计划顺利推进。\n\n## 二、主要成效\n\n通过上述工作的开展，部门在制度建设、运营效率和团队能力方面得到一定提升，为后续工作奠定了较好基础。\n\n## 三、经验做法\n\n在推进过程中，部门注重统筹协调与过程管理，形成了一些值得继续坚持的做法，相关经验有待进一步总结提炼。\n\n## 四、存在问题\n\n同时，我们也清醒地认识到，工作中还存在一些不足，例如部分工作的量化评估尚不充分，团队协作效率有待进一步提升等，需在后续工作中加以改进。\n\n## 五、下一步计划\n\n下阶段，部门将继续深化内部管理，从制度执行、流程优化和能力提升等方面持续发力，进一步提升整体运营效率。\n\n【落款单位待确认】\n\n【日期待确认】",
  "fact_usage_report": [
    {
      "draft_text": "今年一季度",
      "fact_type": "time",
      "fact_value": "今年一季度",
      "source_text": "今年一季度，部门围绕年度目标推进各项工作",
      "source": "extract_result.fact_items",
      "confidence": 0.95
    },
    {
      "draft_text": "部门",
      "fact_type": "organization",
      "fact_value": "部门",
      "source_text": "部门围绕年度目标推进各项工作",
      "source": "extract_result.fact_items",
      "confidence": 0.9
    },
    {
      "draft_text": "完成制度修订",
      "fact_type": "achievement",
      "fact_value": "完成了制度修订",
      "source_text": "完成了制度修订、流程优化和团队培训",
      "source": "extract_result.fact_items",
      "confidence": 0.95
    },
    {
      "draft_text": "推进流程优化",
      "fact_type": "achievement",
      "fact_value": "完成了流程优化",
      "source_text": "完成了制度修订、流程优化和团队培训",
      "source": "extract_result.fact_items",
      "confidence": 0.95
    },
    {
      "draft_text": "组织团队培训",
      "fact_type": "achievement",
      "fact_value": "完成了团队培训",
      "source_text": "完成了制度修订、流程优化和团队培训",
      "source": "extract_result.fact_items",
      "confidence": 0.95
    }
  ],
  "rag_usage_report": [],
  "terminology_usage_report": [
    {
      "raw_value": "部门",
      "used_value": "部门",
      "type": "organization",
      "source": "extract_result",
      "confidence": 0.9,
      "needs_manual_confirmation": true,
      "note": "部门具体名称未提供，正文沿用用户原文"
    }
  ],
  "blocked_items_check": [
    {
      "item": "编造数据",
      "status": "not_used",
      "reason": "正文未出现任何具体数据，符合要求"
    },
    {
      "item": "只讲成绩不讲问题",
      "status": "used_with_basis",
      "reason": "正文包含'存在问题'部分，虽概括但符合总结必备结构"
    },
    {
      "item": "缺少下一步计划",
      "status": "not_used",
      "reason": "正文包含'下一步计划'部分"
    },
    {
      "item": "编造成果量化指标",
      "status": "not_used",
      "reason": "正文未编造量化指标，仅使用'初步进展''一定提升'等概括表述"
    }
  ],
  "warnings": [
    {
      "level": "medium",
      "type": "missing_field",
      "message": "部门具体名称缺失，正文使用'部门'泛指，需后续确认",
      "related_field": "organization",
      "action": "正式成稿前确认部门全称"
    },
    {
      "level": "medium",
      "type": "missing_field",
      "message": "具体成效数据缺失，正文仅作概括表述",
      "related_field": "data",
      "action": "如有可补充具体数据提升说服力"
    },
    {
      "level": "medium",
      "type": "missing_field",
      "message": "经验做法部分缺少实质内容，正文采用概括性表述",
      "related_field": "经验做法",
      "action": "建议结合实际补充典型经验"
    },
    {
      "level": "medium",
      "type": "missing_field",
      "message": "存在问题部分缺少具体问题，正文采用通用表述",
      "related_field": "存在问题",
      "action": "建议补充实际存在的具体问题"
    },
    {
      "level": "medium",
      "type": "placeholder_used",
      "message": "正文包含【落款单位待确认】和【日期待确认】占位符",
      "related_field": "落款/日期",
      "action": "正式成稿前补充落款单位和日期"
    },
    {
      "level": "low",
      "type": "rag_not_used",
      "message": "本次未使用RAG风格参考（检索结果为财务数据，不适用）",
      "related_field": "style_rag",
      "action": "可后续检索芒果系总结风格案例优化表达"
    }
  ],
  "manual_confirmation_fields": [
    {
      "field": "部门具体名称",
      "reason": "用户仅写'部门'，需确认正式名称",
      "impact": "影响标题和正文准确性",
      "required_before_final": true
    },
    {
      "field": "落款单位",
      "reason": "总结需要落款单位",
      "impact": "影响材料完整性",
      "required_before_final": true
    },
    {
      "field": "存在问题",
      "reason": "总结必须包含问题，用户未提供",
      "impact": "影响正文说服力",
      "required_before_final": false
    },
    {
      "field": "经验做法",
      "reason": "总结结构需要经验做法部分，用户未提供",
      "impact": "影响正文完整性",
      "required_before_final": false
    }
  ],
  "draft_policy": {
    "body_generated": true,
    "no_new_facts": true,
    "use_only_extract_facts": true,
    "rag_used_for_style_only": true,
    "follow_plan_structure": true,
    "follow_doc_type_rules": true,
    "follow_org_title_dictionary": true
  }
}