{
  "draft_summary": "已按报告文种生成初稿。素材包含时间（今年以来）、组织（集团）、项目（重点任务）和成就（前期梳理、资源协调、阶段性复盘），缺少重点任务具体名称、具体时间范围、落款单位。正文按计划四段式结构生成，存在问题段采用概括性表述。本次未获得RAG风格参考。",
  "doc_type": "报告",
  "direction": "上行文",
  "style_level": 2,
  "risk_level": "medium",
  "markdown_draft": "# 关于重点任务推进情况的报告\n\n湖南广播影视集团（台）：\n\n现将重点任务推进情况报告如下。\n\n一、基本情况\n\n今年以来，我们围绕重点任务推进，各项工作有序开展，总体进展平稳。\n\n二、主要工作\n\n已完成前期梳理、资源协调和阶段性复盘，为后续工作奠定了坚实基础。\n\n三、存在问题\n\n在推进过程中，还面临一些挑战和不足，需要在后续工作中进一步聚焦解决。\n\n四、下一步工作\n\n下一步将加强统筹，持续推动重点任务落地见效。\n\n特此报告。\n\n【落款单位待确认】\n【日期待确认】",
  "fact_usage_report": [
    {
      "draft_text": "今年以来",
      "fact_type": "time",
      "fact_value": "今年以来",
      "source_text": "今年以来，相关工作围绕重点任务推进",
      "source": "extract_result.fact_items",
      "confidence": 0.95
    },
    {
      "draft_text": "重点任务",
      "fact_type": "project",
      "fact_value": "重点任务",
      "source_text": "相关工作围绕重点任务推进",
      "source": "extract_result.fact_items",
      "confidence": 0.9
    },
    {
      "draft_text": "完成了前期梳理、资源协调和阶段性复盘",
      "fact_type": "achievement",
      "fact_value": "完成了前期梳理、资源协调和阶段性复盘",
      "source_text": "完成了前期梳理、资源协调和阶段性复盘",
      "source": "extract_result.fact_items",
      "confidence": 0.95
    },
    {
      "draft_text": "加强统筹，推动重点任务落地",
      "fact_type": "project",
      "fact_value": "重点任务（下一步）",
      "source_text": "下一步将继续加强统筹，推动重点任务落地",
      "source": "extract_result.fact_items",
      "confidence": 0.88
    }
  ],
  "rag_usage_report": [],
  "terminology_usage_report": [
    {
      "raw_value": "集团",
      "used_value": "湖南广播影视集团（台）",
      "type": "organization",
      "source": "org-title-dictionary.yaml",
      "confidence": 0.98,
      "needs_manual_confirmation": false,
      "note": "根据口径库将用户简称转为正式全称。"
    },
    {
      "raw_value": "重点任务",
      "used_value": "重点任务",
      "type": "strategic_term",
      "source": "extract_result",
      "confidence": 0.7,
      "needs_manual_confirmation": true,
      "note": "具体任务名称缺失，正文仅保留泛称。"
    }
  ],
  "blocked_items_check": [
    {
      "item": "夹带请示事项",
      "status": "not_used",
      "reason": "正文未出现'请批准''请批复'等请求审批表达。"
    },
    {
      "item": "编造具体时间范围",
      "status": "not_used",
      "reason": "正文仅使用'今年以来'，未编造具体截止时间。"
    },
    {
      "item": "编造具体任务名称",
      "status": "not_used",
      "reason": "正文使用'重点任务'泛称，未编造具体名称。"
    },
    {
      "item": "编造成果数据",
      "status": "not_used",
      "reason": "正文未编造成果数据，仅使用用户提供的概括性表述。"
    },
    {
      "item": "编造问题",
      "status": "not_used",
      "reason": "存在问题段采用概括性表述，未编造具体问题。"
    },
    {
      "item": "编造领导评价",
      "status": "not_used",
      "reason": "正文未出现领导评价。"
    }
  ],
  "warnings": [
    {
      "level": "medium",
      "type": "missing_field",
      "message": "缺少具体时间范围，仅使用'今年以来'。",
      "related_field": "时间范围",
      "action": "正式成稿前建议确认具体截止时间或阶段。"
    },
    {
      "level": "high",
      "type": "missing_field",
      "message": "缺少重点任务具体名称，正文使用泛称。",
      "related_field": "任务名称",
      "action": "正式成稿前需确认重点任务正式名称。"
    },
    {
      "level": "medium",
      "type": "placeholder_used",
      "message": "正文包含【落款单位待确认】和【日期待确认】占位符。",
      "related_field": "落款/日期",
      "action": "正式成稿前需补充落款单位和日期。"
    },
    {
      "level": "medium",
      "type": "section_no_fact_support",
      "message": "S3'存在问题'段落无用户提供的事实，正文采用概括性表述。",
      "related_field": "存在问题",
      "action": "如有具体问题请补充，否则可保留当前概括表述。"
    },
    {
      "level": "low",
      "type": "rag_not_used",
      "message": "本次未获得RAG风格参考。",
      "related_field": "style_rag",
      "action": "后续可检索芒果系报告风格案例优化表达。"
    }
  ],
  "manual_confirmation_fields": [
    {
      "field": "重点任务具体名称",
      "reason": "影响标题和正文主体内容",
      "impact": "",
      "required_before_final": false
    },
    {
      "field": "落款单位",
      "reason": "报告必须有落款单位",
      "impact": "",
      "required_before_final": false
    },
    {
      "field": "存在问题段落",
      "reason": "用户素材未提供问题内容",
      "impact": "",
      "required_before_final": false
    }
  ],
  "draft_policy": {
    "body_generated": true,
    "no_new_facts": true,
    "use_only_extract_facts": true,
    "rag_used_for_style_only": true,
    "follow_plan_structure": true,
    "follow_doc_type_rules": true,
    "follow_org_title_dictionary": true
  }
}