{
  "draft_summary": "已按新闻稿文种生成初稿。素材包含时间、主办方、参赛规模和获奖作品，缺少活动地点和成果具体细节，使用概括性表述。使用了RAG风格参考借鉴标题和结尾表达。",
  "doc_type": "新闻稿",
  "direction": "对外宣传",
  "style_level": 3,
  "risk_level": "low",
  "generation_mode": "safe_official",
  "official_use_allowed": true,
  "expansion_report": {
    "style_expansion": [],
    "structure_expansion": [],
    "rhetoric_expansion": [],
    "policy_phrase_expansion": [],
    "leadership_style_expansion": [],
    "confirmation_required": [],
    "unsafe_expansion_warnings": []
  },
  "markdown_draft": "# 芒果超媒AI内容创作大赛举行 《AI导演》获一等奖\n\n4月15日，芒果超媒股份有限公司举办AI内容创作大赛。来自12个团队同台竞技，围绕人工智能技术在内容创作领域的应用展开角逐。\n\n本次大赛以AI内容创作为主题，参赛团队涵盖多个业务方向，展现了芒果超媒在AI领域的创新氛围。经过激烈比拼，一等奖作品《AI导演》脱颖而出，该作品实现了全流程AI辅助制作，为内容生产提供了新的智能解决方案。\n\n此次大赛是芒果超媒推动文化和科技融合的又一实践。以大赛为契机，芒果超媒持续探索AI技术在内容创作中的应用，助力智媒跃升。\n\n未来，芒果超媒将继续以技术创新为驱动，深化AI与内容的深度融合，为行业带来更多创新可能。",
  "fact_usage_report": [
    {
      "draft_text": "4月15日",
      "fact_type": "time",
      "fact_value": "4月15日",
      "source_text": "4月15日，芒果超媒举办AI内容创作大赛。",
      "source": "extract_result.fact_items",
      "confidence": 0.98
    },
    {
      "draft_text": "芒果超媒股份有限公司",
      "fact_type": "organization",
      "fact_value": "芒果超媒",
      "source_text": "4月15日，芒果超媒举办AI内容创作大赛。",
      "source": "extract_result.fact_items",
      "confidence": 0.98
    },
    {
      "draft_text": "AI内容创作大赛",
      "fact_type": "event",
      "fact_value": "AI内容创作大赛",
      "source_text": "4月15日，芒果超媒举办AI内容创作大赛。",
      "source": "extract_result.fact_items",
      "confidence": 0.98
    },
    {
      "draft_text": "12个团队",
      "fact_type": "data",
      "fact_value": "12个团队",
      "source_text": "来自12个团队参加。",
      "source": "extract_result.fact_items",
      "confidence": 0.98
    },
    {
      "draft_text": "一等奖作品《AI导演》",
      "fact_type": "product",
      "fact_value": "《AI导演》",
      "source_text": "一等奖作品《AI导演》实现了全流程AI辅助制作。",
      "source": "extract_result.fact_items",
      "confidence": 0.98
    },
    {
      "draft_text": "实现了全流程AI辅助制作",
      "fact_type": "achievement",
      "fact_value": "一等奖作品《AI导演》实现了全流程AI辅助制作",
      "source_text": "一等奖作品《AI导演》实现了全流程AI辅助制作。",
      "source": "extract_result.fact_items",
      "confidence": 0.95
    }
  ],
  "rag_usage_report": [
    {
      "used_for": "标题风格",
      "reference_source": "芒果日志旧稿标题风格",
      "style_element": "使用“举行 《AI导演》获一等奖”的直述式标题",
      "copied_verbatim": false,
      "fact_risk": false,
      "note": "仅借鉴标题结构，未使用旧稿事实。"
    },
    {
      "used_for": "结尾展望",
      "reference_source": "芒果日志旧稿结尾表达",
      "style_element": "以“未来将继续深化……”句式收尾",
      "copied_verbatim": false,
      "fact_risk": false,
      "note": "仅借鉴结尾句式，未使用旧稿事实。"
    }
  ],
  "terminology_usage_report": [
    {
      "raw_value": "芒果超媒",
      "used_value": "芒果超媒股份有限公司",
      "type": "organization",
      "source": "org-title-dictionary.yaml",
      "confidence": 0.98,
      "needs_manual_confirmation": false,
      "note": "首次出现使用全称。"
    },
    {
      "raw_value": "《AI导演》",
      "used_value": "《AI导演》",
      "type": "product",
      "source": "extract_result",
      "confidence": 0.98,
      "needs_manual_confirmation": false,
      "note": ""
    },
    {
      "raw_value": "AI内容创作大赛",
      "used_value": "AI内容创作大赛",
      "type": "other",
      "source": "extract_result",
      "confidence": 0.98,
      "needs_manual_confirmation": false,
      "note": ""
    }
  ],
  "blocked_items_check": [
    {
      "item": "领导出席",
      "status": "not_used",
      "reason": "用户未提供领导出席信息，正文未编造。"
    },
    {
      "item": "领导评价",
      "status": "not_used",
      "reason": "用户未提供领导评价，正文未编造。"
    },
    {
      "item": "成果数据",
      "status": "not_used",
      "reason": "用户未提供具体成果数据，正文未编造。"
    },
    {
      "item": "活动地点",
      "status": "not_used",
      "reason": "用户未提供活动地点，正文未补充。"
    },
    {
      "item": "参赛团队详情",
      "status": "not_used",
      "reason": "用户未提供具体团队名称或来源，正文未编造。"
    },
    {
      "item": "作品技术细节",
      "status": "not_used",
      "reason": "用户未提供《AI导演》具体技术细节，正文未编造。"
    }
  ],
  "warnings": [
    {
      "level": "medium",
      "type": "missing_field",
      "message": "活动地点缺失，正文未写地点。",
      "related_field": "活动地点",
      "action": "如活动有具体地点，建议补充。"
    },
    {
      "level": "medium",
      "type": "missing_field",
      "message": "一等奖作品具体实现细节缺失，正文仅概括表述。",
      "related_field": "作品技术细节",
      "action": "如需深度报道，可后续补充。"
    },
    {
      "level": "low",
      "type": "missing_field",
      "message": "参赛团队详情缺失，正文仅写“12个团队”。",
      "related_field": "参赛团队详情",
      "action": "如需丰富内容，可后续补充。"
    },
    {
      "level": "low",
      "type": "risk_flag",
      "message": "组织机构名称“芒果超媒”为简称，正文已使用全称。",
      "related_field": "organization",
      "action": ""
    }
  ],
  "manual_confirmation_fields": [],
  "draft_policy": {
    "body_generated": true,
    "no_new_facts": true,
    "use_only_extract_facts": true,
    "rag_used_for_style_only": true,
    "follow_plan_structure": true,
    "follow_doc_type_rules": true,
    "follow_org_title_dictionary": true
  }
}